{
  "schemaVersion": 1,
  "reportId": "acceptance-20260917-001",
  "requestId": "release-4.1.0-compose",
  "createdAt": "2026-09-17T02:00:00Z",
  "environment": {
    "id": "compose-ci-amd64",
    "deploymentMode": "compose",
    "os": "Ubuntu 24.04",
    "architecture": "amd64",
    "runtime": {
      "docker": "28.3.3",
      "compose": "2.39.1"
    }
  },
  "release": {
    "commit": "0123456789abcdef0123456789abcdef01234567",
    "productVersion": "4.1.0",
    "databaseSchemaVersion": "4.1.0",
    "configSchemaVersion": 1,
    "components": [
      {
        "name": "server",
        "version": "1.0.0",
        "imageDigest": "sha256:aaaaaaaaaaaaaaaaaaaaaaaaaaaaaaaaaaaaaaaaaaaaaaaaaaaaaaaaaaaaaaaa"
      },
      {
        "name": "app",
        "version": "1.0.0",
        "imageDigest": "sha256:bbbbbbbbbbbbbbbbbbbbbbbbbbbbbbbbbbbbbbbbbbbbbbbbbbbbbbbbbbbbbbbb"
      }
    ]
  },
  "steps": [
    {
      "id": "compose-config",
      "evidenceLevel": "E0",
      "status": "passed",
      "check": "docker compose config and port policy",
      "startedAt": "2026-09-17T01:59:00Z",
      "completedAt": "2026-09-17T01:59:03Z",
      "exitCode": 0,
      "summary": "Four declared Compose variants passed static validation."
    }
  ],
  "samples": [],
  "artifacts": [],
  "backup": {
    "backupId": "backup-not-created",
    "verificationStatus": "not_run",
    "restoreStatus": "not_run"
  },
  "gaps": [
    "No real PDF smoke test or restore exercise was executed."
  ],
  "overall": "blocked"
}
